{
  "schema_version": "net.transport.adapter.v1",
  "transport_adapter_id": "transport_demo_lan_http",
  "endpoint_id": "endpoint_demo_lan_http",
  "transport_label": "Demo LAN HTTP transport adapter",
  "transport_kind": "lan_http",
  "transport_scope": "lan",
  "transport_state": "declared",
  "transport_security": "declared_remote",
  "stream_profile": "stream_envelope_v1_chunked",
  "metadata": {
    "synthetic": true,
    "declared_only": true,
    "no_network_io": true,
    "note": "Descriptor only; no LAN transport is implemented."
  },
  "declared_at_unix_ms": 0
}
