{
  "schema_version": "net.transport.adapter.v1",
  "transport_adapter_id": "transport_demo_remote_http",
  "endpoint_id": "endpoint_demo_remote_http",
  "transport_label": "Demo remote HTTP transport adapter",
  "transport_kind": "remote_http",
  "transport_scope": "remote",
  "transport_state": "declared",
  "transport_security": "declared_remote",
  "stream_profile": "stream_envelope_v1_chunked",
  "metadata": {
    "synthetic": true,
    "declared_only": true,
    "no_network_io": true,
    "note": "Descriptor only; no remote transport is implemented."
  },
  "declared_at_unix_ms": 0
}
