{
  "schema_version": "net.transport.adapter.v1",
  "transport_adapter_id": "transport_demo_localhost_http",
  "endpoint_id": "endpoint_demo_localhost_http",
  "transport_label": "Demo localhost HTTP transport adapter",
  "transport_kind": "localhost_http",
  "transport_scope": "machine",
  "transport_state": "declared",
  "transport_security": "trusted_local",
  "stream_profile": "stream_envelope_v1_chunked",
  "metadata": {
    "synthetic": true,
    "declared_only": true,
    "no_network_io": true,
    "note": "Descriptor only; no localhost HTTP is implemented."
  },
  "declared_at_unix_ms": 0
}
