{
  "schema_version": "net.transport.adapter.v1",
  "transport_adapter_id": "transport_demo_local_ipc",
  "endpoint_id": "endpoint_demo_local_ipc",
  "transport_label": "Demo local IPC transport adapter",
  "transport_kind": "local_ipc",
  "transport_scope": "machine",
  "transport_state": "declared",
  "transport_security": "trusted_local",
  "stream_profile": "stream_envelope_v1",
  "metadata": {
    "synthetic": true,
    "declared_only": true,
    "no_network_io": true,
    "note": "Descriptor only; no IPC channel is implemented."
  },
  "declared_at_unix_ms": 0
}
