{
  "schema_version": "net.transport.adapter.v1",
  "transport_adapter_id": "transport_demo_future",
  "endpoint_id": "endpoint_demo_future_transport",
  "transport_label": "Demo future transport adapter",
  "transport_kind": "future",
  "transport_scope": "external",
  "transport_state": "unknown",
  "transport_security": "external_untrusted",
  "stream_profile": "stream_envelope_v1_future",
  "metadata": {
    "synthetic": true,
    "declared_only": true,
    "no_network_io": true,
    "note": "Descriptor only; future transport is not implemented."
  },
  "declared_at_unix_ms": 0
}
